{
  "schema_version": "1.0",
  "prototype_id": "sl-prototype-0016",
  "name": "案例短评",
  "question_type": "贯彻执行",
  "trigger_signals": ["案例短评", "为案例撰写短评", "案例摘要", "案例汇编"],
  "exclusion_signals": ["情况报告", "提案"],
  "required_task_elements": ["案例对象", "材料来源范围", "字数限制"],
  "optional_task_elements": ["评论角度"],
  "default_format_reference": "标题+正文（做法+效果，分段不写序号）",
  "workflow_stages": ["审题", "材料遍", "要点提取", "组织结构", "论证"],
  "recommended_card_ids": ["sl-card-0036", "sl-card-0076"],
  "mode_routes": {
    "审题": ["sl-card-0036"],
    "解析": ["sl-card-0036", "sl-card-0076"],
    "批改": ["sl-card-0067"],
    "修改二稿": ["sl-card-0068"]
  },
  "fallback_behavior": "未命中原型时回退到贯彻执行通用路由",
  "constraints": ["案例短评通常不使用序号词", "必须包含做法和效果"],
  "evidence_refs": ["national-exam-2023-municipal-q2"]
}
