{
  "schema_version": "1.0",
  "prototype_id": "sl-prototype-0015",
  "name": "发言提纲",
  "question_type": "贯彻执行",
  "trigger_signals": ["发言稿", "发言提纲", "座谈会上的发言"],
  "exclusion_signals": ["讲话稿", "情况报告", "谈话提纲", "倡议书", "公开信", "编者按"],
  "required_task_elements": ["发言身份", "发言场合", "材料来源范围", "字数限制"],
  "optional_task_elements": ["发言对象"],
  "default_format_reference": "标题+正文（按主体或问题分类组织）",
  "workflow_stages": ["审题", "材料遍", "要点提取", "组织结构"],
  "recommended_card_ids": ["sl-card-0036", "sl-card-0037", "sl-card-0040"],
  "mode_routes": {
    "审题": ["sl-card-0036", "sl-card-0040"],
    "解析": ["sl-card-0036", "sl-card-0037", "sl-card-0040"],
    "批改": ["sl-card-0067"],
    "修改二稿": ["sl-card-0068"]
  },
  "fallback_behavior": "未命中原型时回退到贯彻执行通用路由",
  "constraints": ["发言提纲需考虑场合和对象", "内容从材料提取"],
  "evidence_refs": ["national-exam-2023-enforcement-q2"]
}
