{
  "schema_version": "1.0",
  "prototype_id": "sl-prototype-0010",
  "name": "汇报总结类",
  "question_type": "贯彻执行",
  "trigger_signals": ["情况报告", "情况简报", "工作简报", "调研报告", "考察报告", "汇报提纲", "工作情况汇报", "经验交流材料", "经验交流*提纲", "汇报*主要内容"],
  "exclusion_signals": ["讲话稿", "倡议书", "短评", "提案", "宣传", "工作指南", "通知"],
  "required_task_elements": ["汇报对象", "身份", "材料来源范围", "字数限制"],
  "optional_task_elements": ["汇报目的", "对象要求"],
  "default_format_reference": "标题+正文（成效/问题/建议等组件按题面选择）",
  "workflow_stages": ["审题", "材料遍", "要点提取", "组织结构", "表达"],
  "recommended_card_ids": ["sl-card-0036", "sl-card-0037", "sl-card-0075"],
  "mode_routes": {
    "审题": ["sl-card-0036"],
    "解析": ["sl-card-0036", "sl-card-0037", "sl-card-0075"],
    "批改": ["sl-card-0067"],
    "修改二稿": ["sl-card-0068"]
  },
  "fallback_behavior": "未命中原型时回退到贯彻执行通用路由",
  "constraints": ["内容组件从材料选择", "建议必须针对不足", "题面未要求建议时不得强行补建议", "区分考察报告与调研报告的内容侧重"],
  "evidence_refs": ["national-exam-2024-enforcement-q3"]
}
