{
  "schema_version": "1.0",
  "prototype_id": "sl-prototype-0020",
  "name": "沟通动员类",
  "question_type": "贯彻执行",
  "trigger_signals": ["倡议书", "公开信", "沟通动员", "呼吁*参与*行动", "致*的公开信"],
  "exclusion_signals": ["报告", "讲话稿", "发言稿", "宣传", "工作指南", "工作方案"],
  "required_task_elements": ["沟通对象", "动员目的", "材料来源范围", "字数限制"],
  "optional_task_elements": ["标题", "称呼", "署名", "日期"],
  "default_format_reference": "候选参考：称呼+正文+署名日期，倡议书以号召结尾，公开信以呼吁结尾。题面明确要求优先；题面沉默时按最简候选格式选择，未采用项不自动扣分。",
  "workflow_stages": ["审题", "材料遍", "要点提取", "组织结构", "表达"],
  "recommended_card_ids": ["sl-card-0036", "sl-card-0083"],
  "mode_routes": {
    "审题": ["sl-card-0036", "sl-card-0083"],
    "解析": ["sl-card-0036", "sl-card-0037", "sl-card-0083"],
    "批改": ["sl-card-0067"],
    "修改二稿": ["sl-card-0068"]
  },
  "fallback_behavior": "未命中时停止并说明无法确定文种，不得硬套讲话稿或宣传稿",
  "constraints": ["题目明确要求优先于文种惯例", "倡议书必须有号召，公开信必须有呼吁", "不得套用讲话稿固定结构", "格式要素以题目要求为准，题目未提时不为强制"],
  "evidence_refs": []
}
