{
  "schema_version": "1.0",
  "prototype_id": "sl-prototype-0008",
  "name": "原因+对策",
  "question_type": "提出对策",
  "trigger_signals": ["分析原因并提出对策", "原因+对策", "原因*提出*对策", "原因*提出*建议"],
  "exclusion_signals": ["梳理问题并提出建议", "他是如何解决", "小雷是如何解决", "干部是如何解决", "工作人员是如何解决", "团队是如何解决"],
  "required_task_elements": ["问题对象", "材料来源范围"],
  "optional_task_elements": ["对策主体限定"],
  "default_format_reference": "先分析原因，再提出对应对策",
  "workflow_stages": ["审题", "材料遍", "要点提取", "组织结构"],
  "recommended_card_ids": ["sl-card-0017", "sl-card-0025"],
  "mode_routes": {
    "审题": ["sl-card-0017"],
    "解析": ["sl-card-0017", "sl-card-0025"],
    "批改": ["sl-card-0020"],
    "修改二稿": ["sl-card-0020"]
  },
  "fallback_behavior": "未命中原型时回退到提出对策通用路由",
  "constraints": ["原因与对策必须一一对应", "对策必须有针对性"],
  "evidence_refs": ["national-exam-2024-sub-provincial-q3"]
}
