{
  "schema_version": "1.0",
  "prototype_id": "sl-prototype-0021",
  "name": "方案指导类",
  "question_type": "贯彻执行",
  "trigger_signals": ["工作方案", "通知", "工作要点", "拟写*方案", "部署*工作", "下一步工作安排", "起草*建议", "拟写*建议", "写一份*建议", "关于*建议"],
  "exclusion_signals": ["报告", "讲话稿", "倡议书", "宣传", "工作指南", "公开信", "提案", "建议案"],
  "required_task_elements": ["工作目标或缘由", "措施或事项", "材料来源范围", "字数限制"],
  "optional_task_elements": ["标题", "发文单位", "日期", "工作要求"],
  "default_format_reference": "候选参考：标题+正文，结构按题面要求以目标→措施→保障或缘由→事项→要求组织。题面明确要求优先；题面沉默时按最简候选格式选择，未采用项不自动扣分。",
  "workflow_stages": ["审题", "材料遍", "要点提取", "组织结构", "表达"],
  "recommended_card_ids": ["sl-card-0036", "sl-card-0084"],
  "mode_routes": {
    "审题": ["sl-card-0036", "sl-card-0084"],
    "解析": ["sl-card-0036", "sl-card-0037", "sl-card-0084"],
    "批改": ["sl-card-0067"],
    "修改二稿": ["sl-card-0068"]
  },
  "fallback_behavior": "未命中时停止并说明无法确定文种，不得硬套情况报告",
  "constraints": ["题目明确要求优先于文种惯例", "措施必须有材料依据且可操作", "不得补充材料中不存在的措施", "不得套用情况报告固定结构", "发文单位、日期等为候选格式要素，题面未提时不为强制扣分项"],
  "evidence_refs": []
}
