{
  "schema_version": "1.0",
  "prototype_id": "sl-prototype-0011",
  "name": "短评",
  "question_type": "贯彻执行",
  "trigger_signals": ["短评"],
  "exclusion_signals": ["情况报告", "提案", "讲话稿"],
  "required_task_elements": ["评论对象", "材料来源范围", "字数限制"],
  "optional_task_elements": ["评论角度"],
  "default_format_reference": "标题+正文（观点→论据→总结，连贯论述）",
  "workflow_stages": ["审题", "材料遍", "要点提取", "组织结构", "论证"],
  "recommended_card_ids": ["sl-card-0036", "sl-card-0076"],
  "mode_routes": {
    "审题": ["sl-card-0036"],
    "解析": ["sl-card-0036", "sl-card-0076"],
    "批改": ["sl-card-0067"],
    "修改二稿": ["sl-card-0068"]
  },
  "fallback_behavior": "未命中原型时回退到贯彻执行通用路由",
  "constraints": ["短评通常不使用序号词", "观点必须明确", "论据必须支持观点"],
  "evidence_refs": ["national-exam-2021-sub-provincial-q4", "national-exam-2023-municipal-q2"]
}
